参数1_文本,书名,章节名称
周迟低头看着手中的这柄剑，剑身上铁锈斑驳，并无铭文，不曾有剑名，不过倒是很直。,人间有剑,第十八章 悬草
周迟掌心气息涌动，落入飞剑之中，他想要再次确认，双方是否契合。,人间有剑,第十八章 悬草
飞剑再次颤动了一下，有些微弱回应。,人间有剑,第十八章 悬草
裴伯称赞道：“好剑！”,人间有剑,第十八章 悬草
周迟看着他，有些茫然。,人间有剑,第十八章 悬草
好在何处？,人间有剑,第十八章 悬草
裴伯一本正经道：“这柄剑不是也很直吗？”,人间有剑,第十八章 悬草
周迟没办法反驳。,人间有剑,第十八章 悬草
这柄剑看着寻常，但真的，跟他算是契合。,人间有剑,第十八章 悬草
裴伯说道：“不过得磨一下。”,人间有剑,第十八章 悬草
他笑道：“我帮你磨一下？”,人间有剑,第十八章 悬草
周迟想了想，摇头道：“我自己来。”,人间有剑,第十八章 悬草
既然已经选定了剑，那磨剑这件事，自然也是自己来才好。,人间有剑,第十八章 悬草
“先给这柄剑取个名字？”,人间有剑,第十八章 悬草
裴伯笑着提议。,人间有剑,第十八章 悬草
周迟想了想，“就叫悬草吧。”,人间有剑,第十八章 悬草
“悬草？”,人间有剑,第十八章 悬草
裴伯重复了一遍，仔细嚼了嚼这两个字，笑道：“你这小子，倒是足够明白自己的处境，以被风吹起的野草自比。”,人间有剑,第十八章 悬草
“不过，你这名字虽说取得好，要是没能进入内门，剑是要被收回去的。”,人间有剑,第十八章 悬草
“不会的。”,人间有剑,第十八章 悬草
周迟握住剑柄，这柄剑不会被人要回去的。,人间有剑,第十八章 悬草
至于裴伯说的那个意思。,人间有剑,第十八章 悬草
也不对。,人间有剑,第十八章 悬草
也不对。,人间有剑,第十九章 磨剑
哧哧——,人间有剑,第十九章 磨剑
盛夏的那座藏书楼里，每天都传出磨剑声。,人间有剑,第十九章 磨剑
悬草上面的铁锈清除了大半，但仍旧还有小半在剑身上。,人间有剑,第十九章 磨剑
最开始裴伯来看过几次，眼见周迟的进度这么慢，他再次提出帮忙，不过毫无意外的，被周迟拒绝了。,人间有剑,第十九章 磨剑
被拒的裴伯也不生气，就是之后再来藏书楼打扫，也不再多管闲事，只是偶尔在周迟磨剑的时候，他会在一旁坐会儿，说些闲话。,人间有剑,第十九章 磨剑
而周迟之所以磨剑如此之慢，其实并非真的铁锈难以去除，而是在磨剑的过程中，他一直在熟悉这柄飞剑。,人间有剑,第十九章 磨剑
剑修里一直有个说法，叫做好剑如烈马，烈马需要驯，好的飞剑有灵，想要飞剑俯首帖耳，自然缺不了水磨功夫。,人间有剑,第十九章 磨剑
虽说飞剑和剑主双方已经是相互产生了联系，但想要彻底将飞剑降服，还是需要一番较劲。不过周迟的情况倒是不同，他花这么多时间，全然是因为这柄被它取名悬草的飞剑，虽和他有些契合，但是飞剑本身太过寻常，并非是所谓的神兵，所以不得不多花时间熟悉悬草。,人间有剑,第十九章 磨剑
也只有如此，等以后持剑对敌的时候，才能做到如指臂使。,人间有剑,第十九章 磨剑
不过此后温养这柄飞剑，需要耗费的功夫，肯定不会少就是了。,人间有剑,第十九章 磨剑
其实也不会有太多剑修和他一样，会选择一柄怎么看都很寻常的本命飞剑。,人间有剑,第十九章 磨剑
这意味着在温养飞剑上，他便需要付出比别人更多的时间。,人间有剑,第十九章 磨剑
只是周迟并不在意这种事情，在他看来，剑道一途，其实最主要的还是在于自己，飞剑虽说是剑修的本命器，但始终是外物。,人间有剑,第十九章 磨剑
自身足够强，飞剑自然便也强。,人间有剑,第十九章 磨剑
想着这些，磨着剑，一晃眼，便已经过去半旬时光。,人间有剑,第十九章 磨剑
这一日，藏书楼外响起些脚步声，从步频来判断，明显不是裴伯的，因此周迟就停下了手里磨剑的事。,人间有剑,第十九章 磨剑
他仰起头，看到了多月不见的柳胤。,人间有剑,第十九章 磨剑
这位玄意峰唯一的内门弟子，自从那日把周迟带上玄意峰之后，便几乎销声匿迹的柳师姐脸上有些疲惫之意，看到周迟要起身，她便挥挥手，示意不用。,人间有剑,第十九章 磨剑
柳胤一屁股坐在周迟旁边，微笑道：“我听裴伯说了，你已经破境入方寸，还寻到了自己的本命飞剑，很不错。”,人间有剑,第十九章 磨剑
周迟说道：“还是慢了些，同时上山的弟子里，已经有方寸圆满，如今已经进入内门的了。”,人间有剑,第十九章 磨剑
孟寅之前给他捎过口信来，说是已经方寸圆满，已经去参加内门考核了，并嘱咐周迟快一些。,人间有剑,第十九章 磨剑
进入内门之后，其实修行便要忙一些了，就算是孟寅那个天赋，也要认真对待，所以这些日子，才没有他的消息。,人间有剑,第十九章 磨剑
柳胤听着周迟这话，有些自责道：“本来你天赋便寻常，我身为师姐，应当多看顾你，多对你的修行上心的，只是玄意峰琐事也多，我不得不下山数月……”,人间有剑,第十九章 磨剑
柳胤满眼歉意，周迟是这些年玄意峰的唯一独苗，虽说天赋一般，但不管怎么看，其实都该好好刨开其他事情好生教导他修行的，不过确也是玄意峰人少，有些事情，让她不得不做。,人间有剑,第十九章 磨剑
周迟也算是过来人，听着柳胤说下山数月，其实也隐约猜到些东西了，一座宗门的运转，颇为复杂，绝对不只是一些人每日在山中安然修行，便能维持运转的，光说一个那每个月给外门弟子发放的丹药，如何得来，便不简单。,人间有剑,第十九章 磨剑
从获取灵药，到练成丹药，这看似简单，但实则并不容易，就拿祁山来说，祁山一山上下都是剑修，光是炼丹一事，便无一人会，所以修行所需的那些丹药，全是在其他宗门那边购买的，而用以购买丹药，则需梨花钱，可何处而来？,人间有剑,第十九章 磨剑
所以这里便需要一批剑修，在修行之余，要负责为一座祁山去获取梨花钱。,人间有剑,第十九章 磨剑
重云山的结构要比祁山完善得多，山中弟子分工不同，不过可以肯定的是，玄意峰的剑修，有且只能充当一种角色。,人间有剑,第十九章 磨剑
那就是出剑者。,人间有剑,第十九章 磨剑
类似于当初周迟上圣灵山那般。,人间有剑,第十九章 磨剑
“师姐不必自责，这些日子我在裴伯那边，学到不少，也算不错。”,人间有剑,第十九章 磨剑
周迟说了句违心话，脸有些红。,人间有剑,第十九章 磨剑
柳胤点点头，“裴伯虽说不曾修行，但上山日久，看过的东西不少，更是和前任峰主有许多交情，很多时候都有见解，我当初才上山，也受了他许多点拨。”,人间有剑,第十九章 磨剑
“我不在峰中的时候，你可多向裴伯请教。”,人间有剑,第十九章 磨剑
周迟微微皱眉，心想这跟自己认识的裴伯，是一个人吗？,人间有剑,第十九章 磨剑
“好了，你有什么问题，便问吧，山中除去我和峰主之外，也没别的剑修了，想来你肯定有许多关于剑道的疑难，一直不曾找到人询问吧？”,人间有剑,第十九章 磨剑
柳胤看向周迟，一副你随便问即可的样子。,人间有剑,第十九章 磨剑
周迟有些为难，如果他没有看错的话，眼前这位柳师姐，其实也只是个玉府境的剑修。,人间有剑,第十九章 磨剑
而自己，自废修为之前，实打实已经是天门境了啊！,人间有剑,第十九章 磨剑
他当然有些问题，但怎么看，都不是眼前这位柳师姐能够给他解答的。,人间有剑,第十九章 磨剑
但看着柳胤一脸期待的样子，周迟还是捏着鼻子，问了几个不痛不痒的问题。,人间有剑,第十九章 磨剑
“我看书上有凝结剑气一说，天地元气吸纳进入体内是为气机，而剑修则是要将这些气机转化为剑气，这个过程，在玉府之前，是否可行？”,人间有剑,第十九章 磨剑
前几个问题，柳胤还轻车熟路，到了最后一个问题，这位柳师姐也有些犯难了。,人间有剑,第十九章 磨剑
然后周迟就看着她满头大汗地开始在藏书楼里跑上跑下的翻看典籍。,人间有剑,第十九章 磨剑
对此，周迟有些想给自己一巴掌，众所周知，剑修需要修行到玉府境，在体内建造玉府之后才能将气机转化为剑气，但这一次重修，他本就是在探索不可能的事情，那个问题，本是自己思索的，刚刚不知道怎么，就随口说了出来。,人间有剑,第十九章 磨剑
而柳胤其实也只需要答个不可也就算了。,人间有剑,第十九章 磨剑
可惜这位柳师姐，好像是个极为认真的人。,人间有剑,第十九章 磨剑
一炷香之后，实在有些看不下去的周迟说道：“柳师姐，或许玉府作为剑气转化的必要之物，气机需要在玉府处积累的足够多，才有可能转化成……”,人间有剑,第十九章 磨剑
说到这里，周迟微微蹙眉，他想到了些什么。,人间有剑,第十九章 磨剑
还在埋头翻看典籍的柳胤听着这话也抬起头来，“对了，就是这么个说法，那年我依稀记得师父就是这么跟我说的。”,人间有剑,第十九章 磨剑
说到这里，柳胤看向周迟，眼里满是赞赏，“周师弟，看起来你天赋虽然眼看着要比旁人差不少，在冬至那一批上山的弟子里，很显然是垫底，修行也极为困难，但看起来悟性还不错啊！”,人间有剑,第十九章 磨剑
周迟无语地看着柳胤，到底是谁教她这么说话的？,人间有剑,第十九章 磨剑
摇了摇头，周迟在心里默默叹了口气。,人间有剑,第十九章 磨剑
不过闹出这么个小插曲之后，周迟也就没有再询问什么。,人间有剑,第十九章 磨剑
“周师弟，大家都觉得天赋最重要，但其实我来看，悟性其实更重要，你有这样的悟性，肯定不会止步不前的，进入内门，肯定没问题。”,人间有剑,第十九章 磨剑
柳胤看着周迟，大概是想鼓励一番周迟。,人间有剑,第十九章 磨剑
周迟也抬头看着她，沉默了很久，才说道：“柳师姐。”,人间有剑,第十九章 磨剑
“怎么？”,人间有剑,第十九章 磨剑
“是不是不会骗人？”,人间有剑,第十九章 磨剑
“有一点。”,人间有剑,第十九章 磨剑
周迟叹了口气，看着那一脸怎么都说不上真诚的柳胤，“有些话，既然说出来自己都不相信，那就不要说。”,人间有剑,第十九章 磨剑
柳胤脸红了红，有些不好意思地开口，“被你听出来了啊。”,人间有剑,第十九章 磨剑
“很难听不出来。”,人间有剑,第十九章 磨剑
周迟摆了摆手，“柳师姐，要是有什么事，要不然就先走？”,人间有剑,第十九章 磨剑
“本来我应该在峰中看顾教导你，毕竟这马上要入秋了，你的时间已经不多，可身上杂事太多，实在是留不下来，就这会儿功夫，都是勉强挤出来的时间。”,人间有剑,第十九章 磨剑
柳胤再次表露歉意，她拍了拍周迟的肩膀，想了想，最后只是说道：“要努力啊。”,人间有剑,第十九章 磨剑
周迟看着她说道：“柳师姐在山下，也要注意安全。”,人间有剑,第十九章 磨剑
柳胤点了点头，没有再说什么，转身便离开了。,人间有剑,第十九章 磨剑
等柳胤离开之后，周迟开始继续磨剑，但在磨剑之时，他的思绪已经回到了自己之前提出的那个问题上。,人间有剑,第十九章 磨剑
不建造玉府，体内便无法将气机转化成剑气？,人间有剑,第十九章 磨剑
东洲的剑修，历来如此认知。,人间有剑,第十九章 磨剑
但东洲之外呢？,人间有剑,第十九章 磨剑
那张选的话，依旧萦绕在他脑中。,人间有剑,第十九章 磨剑
在此之前，他从未多想过，只是按着前辈的修行方法修行，从未想过这样是否是错的，或是……除此之外，还有没有更好的。,人间有剑,第十九章 磨剑
“玉府里积累足够多的气机，才可转化成剑气……”,人间有剑,第十九章 磨剑
“若是在窍穴里积累气机呢？”,人间有剑,第十九章 磨剑
周迟磨着剑，体内的气机已经不断朝着神阙里涌去，这个地方是之后建造玉府之处，如今尚无玉府，很多修士都会忽略它。,人间有剑,第十九章 磨剑
但周迟却想试试。,人间有剑,第十九章 磨剑
半日之后，他将这处窍穴填满。,人间有剑,第十九章 磨剑
然后他开始磨剑，以及尝试把神阙穴里的气机转化为剑气。,人间有剑,第十九章 磨剑
如果一旦成功，他或许会成为如今东洲，第一位在玉府境之前，便已经滋生出剑气的剑修。,人间有剑,第十九章 磨剑
这或许对于其余剑修来说，意味着在玉府境之前，他便是剑修中最强的存在。,人间有剑,第十九章 磨剑
但对周迟来说，意义则是在于，当不止玉府能滋生剑气的时候。,人间有剑,第十九章 磨剑
这样获得的益处，一定会贯穿他的一生。,人间有剑,第十九章 磨剑
这样获得的益处，一定会贯穿他的一生。,人间有剑,第二十章 秋意浓，嫉意更浓
一缕秋风，吹拂一片落叶入楼。,人间有剑,第二十章 秋意浓，嫉意更浓
周迟身前的地板上有些积水，秋叶跌入其中，发出极为轻微的一道声响。,人间有剑,第二十章 秋意浓，嫉意更浓
磨剑许久的周迟停下了手里的动作，从一侧拿起一块布条，将悬草剑身上的那些残留铁锈擦去。,人间有剑,第二十章 秋意浓，嫉意更浓
如今，一柄飞剑，终于变回了它原本的模样。,人间有剑,第二十章 秋意浓，嫉意更浓
剑身雪白，散发着凛凛寒光。,人间有剑,第二十章 秋意浓，嫉意更浓
随意握住剑柄挽了个剑花，手感有些陌生，虽说还没能和这柄悬草完全心意相通，但如今的进度，周迟已经十分满意了。,人间有剑,第二十章 秋意浓，嫉意更浓
等到再次踏入玉府境，把飞剑收入玉府之中日夜温养，飞剑和他的联系也好，还是品质也好，都会大幅度提升。,人间有剑,第二十章 秋意浓，嫉意更浓
以剑气淬炼飞剑，只要时间够长，足以让寻常飞剑，渐成神兵。,人间有剑,第二十章 秋意浓，嫉意更浓
松开剑柄，将悬草重新横放在膝间，周迟再次开始内视自身，之前他设想的是否能在玉府境之前将气机转化成剑气，如果真要这么做，这里最大的问题就是在没有玉府这样的一个地方的前提下，如何寻到替代品。,人间有剑,第二十章 秋意浓，嫉意更浓
当时周迟想到的是用窍穴作为替代品。,人间有剑,第二十章 秋意浓，嫉意更浓
他引动气机聚于神阙穴，然后一直在试图把气机转化成剑气。,人间有剑,第二十章 秋意浓，嫉意更浓
这个过程和磨剑一样漫长，从夏天到秋天，终于到了检查成果的时候。,人间有剑,第二十章 秋意浓，嫉意更浓
心念微动，周迟“看向”神阙穴，那个地方，如今就像是一方小池塘，四周不断有水流汇入其中，而在池塘正中，正有涟漪浮现。,人间有剑,第二十章 秋意浓，嫉意更浓
随着周迟的念头落到上方，那些涟漪散开，动静变得越来越大，水面不复平静，就像是在水面下方，有一头什么凶兽，此时此刻正在苏醒。,人间有剑,第二十章 秋意浓，嫉意更浓
随着时间一点点过去，水面正中央，撞出一柄飞剑！,人间有剑,第二十章 秋意浓，嫉意更浓
那柄飞剑整体流光溢彩，散发着雪白光芒，在撞出水面之后，瞬间化作一道白气，离开此地。,人间有剑,第二十章 秋意浓，嫉意更浓
周迟睁开眼睛，掌心翻转，一道白气就此缓慢浮现于掌心之中。,人间有剑,第二十章 秋意浓，嫉意更浓
看着这道白气，周迟眯起眼睛，任由白气在自己掌心乱撞，最后给自己的五指都撞出几道细微伤口。,人间有剑,第二十章 秋意浓，嫉意更浓
周迟看到这一幕，反倒是微微一笑。,人间有剑,第二十章 秋意浓，嫉意更浓
这道白气此刻看着虽说微弱，但实际上已经和寻常气机有所不同，已经能够勉强说是剑气。,人间有剑,第二十章 秋意浓，嫉意更浓
这么一来，就意味着，他的猜想完全正确。,人间有剑,第二十章 秋意浓，嫉意更浓
气机转化成剑气，并不非要玉府。,人间有剑,第二十章 秋意浓，嫉意更浓
以往的东洲剑修，建造玉府之后，在玉府里将气机转化成剑气，然后再将其发散出去，蔓延至体内各处。,人间有剑,第二十章 秋意浓，嫉意更浓
而如今，周迟要反其道而行之，在玉府建立之前，以全身上下的窍穴为根基，以气机转化为剑气，游走体内经脉。,人间有剑,第二十章 秋意浓，嫉意更浓
等到玉府建造，以剑气流转进入玉府……,人间有剑,第二十章 秋意浓，嫉意更浓
甚至在对敌之时，调动剑气，则是不需走一趟玉府，就只是在就近的窍穴里调动，剑气瞬至，很多时候，是能够出其不意，甚至可以保命的。,人间有剑,第二十章 秋意浓，嫉意更浓
换句话说，那野庙一战，若是周迟是以窍穴里的剑气驱动去对敌，当绝不至于如此被动。,人间有剑,第二十章 秋意浓，嫉意更浓
许多时候，他都能占据先机。,人间有剑,第二十章 秋意浓，嫉意更浓
总之，依着周迟来看，想要缩小和中洲修士的修行差距，他的路，就不应该沿着从前那么走。,人间有剑,第二十章 秋意浓，嫉意更浓
他必须要有所变化，才能在下次再遇到中洲修士的时候，没有那么被动。,人间有剑,第二十章 秋意浓，嫉意更浓
野庙那一战，不管是之前布下的剑气陷阱，还是之后让张选所谓的死里逃生，看似都在他的算计之中，但最大的问题还是在于那一战的艰难。,人间有剑,第二十章 秋意浓，嫉意更浓
早有布置，对方也轻敌，境界相当，几乎占据了天时地利人和的周迟，最后还是那般艰难。,人间有剑,第二十章 秋意浓，嫉意更浓
其根本就还是修行上的问题。,人间有剑,第二十章 秋意浓，嫉意更浓
玉京山迟早要面对，那么如何在对上那座中洲仙府之前，让自己变得更强，便是周迟需要关心的事情。,人间有剑,第二十章 秋意浓，嫉意更浓
有些事情，该做，自然是要做的。,人间有剑,第二十章 秋意浓，嫉意更浓
低头捡起身前的秋叶，周迟笑了笑，一叶落而天下秋了。,人间有剑,第二十章 秋意浓，嫉意更浓
……,人间有剑,第二十章 秋意浓，嫉意更浓
“应师弟，虽说你未能进入内门，但你下山之后，也不要走远，我已经向师尊禀告了，若无意外，只需半月，你便可重新上山，虽说不是以内门弟子的身份，但能留在山中，始终是一件好事。”,人间有剑,第二十章 秋意浓，嫉意更浓
唐师兄站在老松台的那棵树下，拍着应麟的肩膀，开口劝慰。,人间有剑,第二十章 秋意浓，嫉意更浓
今年内门考核的确变得艰难了，往年只要境界足够，只需要在本峰的内门弟子手上坚持一刻钟，即可进入内门。,人间有剑,第二十章 秋意浓，嫉意更浓
那些各自峰中的弟子，也几乎会有意无意的放水。,人间有剑,第二十章 秋意浓，嫉意更浓
而如今，不仅考核的人变成了别峰弟子，时间也从一刻钟，变成了三刻。,人间有剑,第二十章 秋意浓，嫉意更浓
在如此前所未有的严苛考察下，今年其实已经有不少往年能够进入内门的弟子，纷纷都无法进入内门了。,人间有剑,第二十章 秋意浓，嫉意更浓
至于应麟，则是一年之期满，未能方寸圆满。,人间有剑,第二十章 秋意浓，嫉意更浓
按着他的天赋来说，本不应如此，大概还是之前的事情，扰乱了他的心神。,人间有剑,第二十章 秋意浓，嫉意更浓
王师兄也说道：“应师弟，你只要自己不放弃，总归会有些前途的。”,人间有剑,第二十章 秋意浓，嫉意更浓
应麟满脸苦涩，看向那边老松台，在他之后的那批弟子，已经有十数人境界圆满，其中七八人，已经进入了内门，如今那边的蒲团，只剩下了三五个。,人间有剑,第二十章 秋意浓，嫉意更浓
依旧有个蒲团，孤零零的就在远处。,人间有剑,第二十章 秋意浓，嫉意更浓
收回视线，应麟苦笑一声，“王师兄，唐师兄，我真能再次上山吗？”,人间有剑,第二十章 秋意浓，嫉意更浓
他如此一问，倒是让唐师兄和王师兄两人有些措手不及，那本就是他们随口说的场面话，实际上，他们两人都没当真。,人间有剑,第二十章 秋意浓，嫉意更浓
为了一个不能进入内门的应麟，别说在山中找师长求情有没有用，即便有用，谁又会真的愿意为了他去浪费精力？,人间有剑,第二十章 秋意浓，嫉意更浓
眼见两位师兄没有第一时间回答，应麟就算再蠢，倒也是猜到了答案，他收起苦涩笑容，拱手道：“师弟祝两位师兄在山中修行一日千里，早日成就道果。”,人间有剑,第二十章 秋意浓，嫉意更浓
两人没有说话，只是微笑点头。,人间有剑,第二十章 秋意浓，嫉意更浓
他们已入内门，前途广阔，早已经和应麟不是一路人。,人间有剑,第二十章 秋意浓，嫉意更浓
应麟深吸一口气，就此要扭头下山。,人间有剑,第二十章 秋意浓，嫉意更浓
可就在他扭头的时候，正好看到一道身影往这边走来。,人间有剑,第二十章 秋意浓，嫉意更浓
正是已经有许久不曾露面的周迟。,人间有剑,第二十章 秋意浓，嫉意更浓
应麟的眼睛变得有些红，呼吸也急促起来，想起之前自己为了能让周迟早早下山，使出的那些手段，结果那些手段用完，周迟能不能进入内门还不好说，但他却已经被周迟言中。,人间有剑,第二十章 秋意浓，嫉意更浓
他要比他更早下山了。,人间有剑,第二十章 秋意浓，嫉意更浓
而且你平日都不离开玄意峰，偏偏在今日，在我要下山的当口，你忽然出来了，那不是为了看我笑话，还能是什么？！,人间有剑,第二十章 秋意浓，嫉意更浓
之前你和孟寅轮流骂我，如今又特意来看我的笑话？,人间有剑,第二十章 秋意浓，嫉意更浓
想到这里，他的心口好像被一块大石头压住那样，让他有些喘不过气来。,人间有剑,第二十章 秋意浓，嫉意更浓
“周迟，你不要得意，我虽然先下山，但我会在山下等着你的，你留不下的！”,人间有剑,第二十章 秋意浓，嫉意更浓
应麟红着双眼，盯着周迟的背影，如同一头择人而噬的猛兽。,人间有剑,第二十章 秋意浓，嫉意更浓
要不是还有残存的理智，他甚至有可能冲上去撕咬周迟也说不准。,人间有剑,第二十章 秋意浓，嫉意更浓
周迟转过身来，看向这个之前找事的家伙，他不知道对方在想什么，至于得意，自己不过来老松台领取丹药，何来得意一说？,人间有剑,第二十章 秋意浓，嫉意更浓
只是周迟这看向应麟沉默不语的样子，又让应麟当成了是胜利者高高在上的俯视。,人间有剑,第二十章 秋意浓，嫉意更浓
这一下子，让他本就崩溃的情绪更加崩溃，“周迟，你就是个废物，你是不可能方寸圆满，不可能进入内门的，你最后的结果，跟我一般无二！”,人间有剑,第二十章 秋意浓，嫉意更浓
他歇斯底里怒吼，惊醒了在老松台打坐的那位朝云峰师叔，那位师叔睁开眼睛，有些不悦地看了这边一眼。,人间有剑,第二十章 秋意浓，嫉意更浓
弟子下山的事情他早已经司空见惯，难以有什么情绪波动，此刻不悦，只是觉得那应麟太过聒噪，而并非同情。,人间有剑,第二十章 秋意浓，嫉意更浓
“应师弟，下山吧。”,人间有剑,第二十章 秋意浓，嫉意更浓
王师兄感受到了那位师叔的不悦，不愿意应麟继续在这里逗留，虽说他所做之事，之前都是他们两人指使，只是如今两人已经进入内门，那桩事情，只能说是尘归尘，土归土了。,人间有剑,第二十章 秋意浓，嫉意更浓
