参数1_文本,书名,章节名称
秦恒：“这会儿还早，给我爸妈和女朋友带去，正好赶上他们的午饭。”,星武纪元,第008章 豪华一餐
他自己有一个肉菜和一个肉汤就足够了，搭配米饭和肉汁，能吃得非常过瘾。,星武纪元,第008章 豪华一餐
难得奢华一顿，可不能忘了对他恩情巨大的方凌雪，以及赐予他生命的父母。,星武纪元,第008章 豪华一餐
听到秦恒这话，众人不禁心生感慨。,星武纪元,第008章 豪华一餐
苏狂小声嘀咕道：“这小白脸还挺有良心。”,星武纪元,第008章 豪华一餐
陈元嘴角一抽：“我也有良心，留了个鸡腿给我妹。倒是某人，吃得那是干干净净啊。”,星武纪元,第008章 豪华一餐
苏狂：……,星武纪元,第008章 豪华一餐
吃饭时，秦恒问了句：“汪鹏呢？走了？”,星武纪元,第008章 豪华一餐
苏狂幽幽说道：“那肯定啊，人家现在是阔少，根本看不上咱们食堂的豪华餐。拿了准考证之后，直接就一脚油门开走了。”,星武纪元,第008章 豪华一餐
张俊适时凑过来，嘿嘿一笑：“恒哥，我替你关注了一下，汪鹏开车是直接去新城区的，没有去霜雪城打扰嫂子。”,星武纪元,第008章 豪华一餐
说着顺势夹走秦恒餐盘里的一条肉丝。,星武纪元,第008章 豪华一餐
“没去就好。”秦恒点点头，没有多言。,星武纪元,第008章 豪华一餐
不过大家都知道，方凌雪对他来说意味着什么。,星武纪元,第008章 豪华一餐
这个女孩对秦恒的意义不仅仅是女朋友，还有再造之恩。,星武纪元,第008章 豪华一餐
即使是苏狂这种臭脾气，也只敢说秦恒小白脸，不敢开方凌雪的玩笑。,星武纪元,第008章 豪华一餐
不然惹恼了秦恒，那就不是嘴皮子的事情了，至少得打到浑身挂彩才行。,星武纪元,第008章 豪华一餐
十分钟后，秦恒吃完了。,星武纪元,第008章 豪华一餐
这一餐吃得很过瘾，他把酱肘子和鸡腿的汤汁都浇在米饭上吃了个干干净净，恨不得把盘子都舔了。,星武纪元,第008章 豪华一餐
吃饱喝足，趁着打包袋里的肉还是热的，他直接离开了武馆。,星武纪元,第008章 豪华一餐
“霜雪城离得近些，先去找凌雪。”,星武纪元,第008章 豪华一餐
试炼武馆离霜雪城只有五分钟路途，不一会儿就看到了霜雪城的店铺招牌。,星武纪元,第008章 豪华一餐
中午时分，按理说奶茶店应该比较清闲。,星武纪元,第008章 豪华一餐
但这会儿店门口却是停着一辆车……,星武纪元,第008章 豪华一餐
“该不会是汪鹏去而复返吧？”秦恒眉头大皱。,星武纪元,第008章 豪华一餐
但是仔细一看，那辆车和汪鹏早上开的明显不是同一辆。,星武纪元,第008章 豪华一餐
汪鹏开的是轻量级的城市跑车，在市区很拉风，价格也贵。,星武纪元,第008章 豪华一餐
而停在霜雪城店门口的，则是一辆越野车。,星武纪元,第008章 豪华一餐
车牌上，赫然标着一个“战”字！,星武纪元,第008章 豪华一餐
“这是一辆荒野战车？”秦恒惊讶道。,星武纪元,第008章 豪华一餐
车牌标注“战”字，说明这是一辆可以驶入荒野区的战斗车辆，外壳加固过，可以防弹、可以承受怪兽的冲撞，价值极其高昂！,星武纪元,第008章 豪华一餐
而且车主必然是一位强大的武者！,星武纪元,第008章 豪华一餐
“高贵的武者居然跑来贫民区喝奶茶？”秦恒很是诧异。,星武纪元,第008章 豪华一餐
虽然对面就是新城区，但新城区是新城区，武者是武者。,星武纪元,第008章 豪华一餐
武者们大多数都是住在市中心附近的高档小区，离贫民区很远，按理说不应该来这里才对。,星武纪元,第008章 豪华一餐
秦恒来到小店门口。,星武纪元,第008章 豪华一餐
这时候，正好有人出来。,星武纪元,第008章 豪华一餐
那是个戴着墨镜的青年男子，看上去不到三十岁，走起路来威风凛凛、气势凌人，有种不可一世的霸道感。,星武纪元,第008章 豪华一餐
秦恒和他对了一眼，隔着墨镜看到两点寒光，慑人心魄，顿时好像有一座大山扑面而来，压力巨大，毫无意识的就让开了去路。,星武纪元,第008章 豪华一餐
“此人的实力肯定比杨教练还要厉害，恐怕是个武师级别的强者！”秦恒心道。,星武纪元,第008章 豪华一餐
青年武者扫了他一眼，没说什么，直接上了车，一脚油门开走了。,星武纪元,第008章 豪华一餐
青年武者扫了他一眼，没说什么，直接上了车，一脚油门开走了。,星武纪元,第009章 不疯魔不成活
“秦恒，你今天怎么这么早就来了？”,星武纪元,第009章 不疯魔不成活
耳边传来少女的声音。,星武纪元,第009章 不疯魔不成活
秦恒的目光从越野车上收回，看向店里。,星武纪元,第009章 不疯魔不成活
“凌雪……你们俩怎么这个表情？”,星武纪元,第009章 不疯魔不成活
这一看，他才发现方凌雪和于玲玲都是一脸难过的样子，忍不住问道：“发生什么事情了？”,星武纪元,第009章 不疯魔不成活
直觉告诉他，两个女孩的反应肯定和刚才那个武者有关。,星武纪元,第009章 不疯魔不成活
方凌雪叹了口气，没说话。,星武纪元,第009章 不疯魔不成活
于玲玲哭丧着脸，解释道：“刚才那个人是我们的老板，他说这家店营收太低了，月底就要关门，以后我们两个就没有工作了……”,星武纪元,第009章 不疯魔不成活
“啊，要关门？”秦恒很意外。,星武纪元,第009章 不疯魔不成活
他还以为两个女孩是被武者欺负了，没想到那人居然是店主！,星武纪元,第009章 不疯魔不成活
于玲玲：“我也想不到，第一次见到老板本人居然会是因为这个。以后可怎么办呐，没了这份薪水，我的弟弟妹妹们……”,星武纪元,第009章 不疯魔不成活
她的表情难过极了。,星武纪元,第009章 不疯魔不成活
霜雪城关门，失去稳定工作的两女，就只能打零工了，收入绝对会大打折扣。,星武纪元,第009章 不疯魔不成活
方凌雪对秦恒道：“秦恒，你别担心，老板给了我们每人500元的遣散费，够你和叔叔阿姨再支撑一阵子了。等明天考核结束，你就是准武者，下个月入学，下下个月就能领到工资，到时候……”,星武纪元,第009章 不疯魔不成活
“凌雪，这……”秦恒心里一阵难受。,星武纪元,第009章 不疯魔不成活
失业的人是方凌雪，这种时候本该是他来安慰她的，怎么却反过来了？,星武纪元,第009章 不疯魔不成活
“你还没说怎么这么早来找我呢？”方凌雪问道，强撑笑脸，试图转移话题。,星武纪元,第009章 不疯魔不成活
“我……”,星武纪元,第009章 不疯魔不成活
秦恒拿出酱肘子和鸡腿。,星武纪元,第009章 不疯魔不成活
“哇，这是给我的吗？”方凌雪眼睛一亮，惊喜道。,星武纪元,第009章 不疯魔不成活
秦恒点头：“今天教练请我们吃豪华餐，我一个人也吃不下那么多，就打包了回来。”,星武纪元,第009章 不疯魔不成活
方凌雪闻言面露笑意：“那我要吃鸡腿，肘子给叔叔阿姨吧。”拿走了明显要小很多的鸡腿。,星武纪元,第009章 不疯魔不成活
“嗯，趁热吃吧。”,星武纪元,第009章 不疯魔不成活
秦恒看着她，心情杂乱。,星武纪元,第009章 不疯魔不成活
两个女孩的午饭已经做好了，煮了一小锅的清水粥，就着腌萝卜和一碟炒青菜，便算是一餐。,星武纪元,第009章 不疯魔不成活
有了鸡腿，方凌雪吃得很开心，还分了一块给于玲玲，本来因为失业而难过的两人，心情似乎好转了一些。,星武纪元,第009章 不疯魔不成活
但秦恒看着她这那纯真烂漫的模样，反而更难受了。,星武纪元,第009章 不疯魔不成活
她本不该是这样的……,星武纪元,第009章 不疯魔不成活
“别傻愣着呀，快回家去，一会儿肘子凉了可不好吃了。”方凌雪看他没走，催促道。,星武纪元,第009章 不疯魔不成活
“凌雪，我……”,星武纪元,第009章 不疯魔不成活
秦恒欲言又止，不知道该如何表达此刻的心情。,星武纪元,第009章 不疯魔不成活
“哦，对了。”,星武纪元,第009章 不疯魔不成活
方凌雪一拍脑袋，放下筷子跑过来，从自己的口袋里掏出五张100元的票子，交到他的手里：“这是老板刚给的，要撑到下下个月准武者工资到手哦。我也没有太多钱了，以后你只能靠自己了。”,星武纪元,第009章 不疯魔不成活
说完又跑回去继续喝粥。,星武纪元,第009章 不疯魔不成活
秦恒张了张嘴，发不出声音，整个人僵在原地。,星武纪元,第009章 不疯魔不成活
喉咙里好像有什么东西哽住了一样，眼前的世界一下变得模糊，被水雾遮挡。,星武纪元,第009章 不疯魔不成活
凌雪……,星武纪元,第009章 不疯魔不成活
她本可以过得很好。,星武纪元,第009章 不疯魔不成活
月薪900，在贫民区绝对是高收入人群，而且她的家里没有负累，三年下来，都已经是个小富婆了。,星武纪元,第009章 不疯魔不成活
可是为了他，却是每天喝清水粥、咽咸菜，过着清苦的日子。,星武纪元,第009章 不疯魔不成活
他甚至已经记不清方凌雪上次吃肉是什么时候了。,星武纪元,第009章 不疯魔不成活
看着她一小口一小口，如品珍馐般的吃着鸡腿肉，连骨节上的软骨都啃得干干净净，秦恒心中的愧疚感，前所未有的浓烈。,星武纪元,第009章 不疯魔不成活
“明天的考核，一定要通过！”,星武纪元,第009章 不疯魔不成活
“等我拿到第一笔工资，她就再也不用这样辛苦了！”,星武纪元,第009章 不疯魔不成活
秦恒在心中说道。,星武纪元,第009章 不疯魔不成活
他不知道自己何德何能，居然遇到这样的好女孩。,星武纪元,第009章 不疯魔不成活
他只知道，自己绝不能辜负方凌雪！,星武纪元,第009章 不疯魔不成活
无论将来赚多少钱，无论成为多厉害的武者，他都必须将自己的一切与方凌雪共享！,星武纪元,第009章 不疯魔不成活
否则的话，就是猪狗不如的畜生！！,星武纪元,第009章 不疯魔不成活
秦恒转身离开，不敢再逗留，生怕被方凌雪看见自己眼睛发红没出息的样子。,星武纪元,第009章 不疯魔不成活
但这一切，早已被两个女孩看见。,星武纪元,第009章 不疯魔不成活
目送秦恒离去，于玲玲小声的对方凌雪说道：“他感动哭了欸。凌雪，你对秦恒真的是太好了，换成是我，我可舍不得把赚来的钱全部给别人花。”,星武纪元,第009章 不疯魔不成活
方凌雪微笑道：“那有什么办法嘛，我也管不了我自己，一有钱就想塞到他的手里去。唉，可能这就是爱情吧。”,星武纪元,第009章 不疯魔不成活
于玲玲撇了撇嘴：“这不是爱情，这是笨蛋。要是以后秦恒成为武者，看到富人世界的花花样子，把你抛弃了怎么办？”,星武纪元,第009章 不疯魔不成活
方凌雪自信道：“不会的，他不是那种人，我相信他！”,星武纪元,第009章 不疯魔不成活
“唉，傻女孩……”,星武纪元,第009章 不疯魔不成活
于玲玲摇头叹息。,星武纪元,第009章 不疯魔不成活
方凌雪：“光说我，你也是傻女孩。”,星武纪元,第009章 不疯魔不成活
于玲玲想了想，摇头：“我才不傻，我只是命不好。”,星武纪元,第009章 不疯魔不成活
“会好的，一切都会好的！”,星武纪元,第009章 不疯魔不成活
“希望如此吧。”,星武纪元,第009章 不疯魔不成活
……,星武纪元,第009章 不疯魔不成活
午后，秦恒回到武馆，继续埋头苦练。,星武纪元,第009章 不疯魔不成活
方凌雪和于玲玲分鸡腿，爸妈两个人分一截肘子的画面，在他脑海中不停回放，挥之不去。,星武纪元,第009章 不疯魔不成活
还有此前一天天、一年年所经历过的一幕幕，都在激励着他，丝毫不敢松懈。,星武纪元,第009章 不疯魔不成活
即使已经知道明天考核必定通过，他仍想在那之前提升一些，以争取到更高的待遇、更多的工资！,星武纪元,第009章 不疯魔不成活
为的，就是让爸妈和凌雪可以过上好日子，再不用为了一口饭的而辛劳，再不用把一块肉视若珍宝，舍不得吃！,星武纪元,第009章 不疯魔不成活
不仅如此，他还希望自己可以更强、更富有一些，帮助更多如邻居林姐姐、于玲玲那样的苦命人，也过上富足的日子。,星武纪元,第009章 不疯魔不成活
呼，呼呼呼……,星武纪元,第009章 不疯魔不成活
机械臂的挥拳动作一刻不停，带起风声。,星武纪元,第009章 不疯魔不成活
陈元和他在同一个训练室做力量训练，看到他设定的频率，不禁咋舌：“秦恒，你这是要疯啊，0.7秒，4个机械拳头，搁我这里早就鼻青脸肿了。”,星武纪元,第009章 不疯魔不成活
秦恒在训练，顾不上开口。,星武纪元,第009章 不疯魔不成活
等一轮敏锐度训练结束了，才回道：“不疯魔不成活，宁可现在多挨几下50公斤的拳头，也要拼命提升，免得以后去了荒野区，挨怪兽的利爪。”,星武纪元,第009章 不疯魔不成活
“话是这么说，还是要张弛有度，别把自己压得太狠，要知道过犹不及。”陈元劝了句。,星武纪元,第009章 不疯魔不成活
秦恒只当没听见，休息了一小会儿，便又继续。,星武纪元,第009章 不疯魔不成活
训练持续了三个小时。,星武纪元,第009章 不疯魔不成活
下午4点多，一个学员过来敲门，说道：“秦师兄，陈师兄，教练叫你们。”,星武纪元,第009章 不疯魔不成活
“好的，就来。”,星武纪元,第009章 不疯魔不成活
两人停下手头上的事情，擦了擦汗走向办公室。,星武纪元,第009章 不疯魔不成活
苏狂也来了，还有另外几个实力比较强的学员，也都出现在办公室。,星武纪元,第009章 不疯魔不成活
“杨教练，你找我们？”苏狂先开口。,星武纪元,第009章 不疯魔不成活
杨怀安把一摞巴掌大的卡片递给他们，说道：“这是你们的准考证，自己收好。明天早上8点之前到武馆集合，我开车送你们去考场。”,星武纪元,第009章 不疯魔不成活
“是！教练！”,星武纪元,第009章 不疯魔不成活
众人都有些激动。,星武纪元,第009章 不疯魔不成活
明天就考核了，改变命运的时刻即将到来！,星武纪元,第009章 不疯魔不成活
杨怀安看了秦恒一眼，说道：“你现在就回家，今晚好好修炼，明天给主考官一个惊喜。”,星武纪元,第009章 不疯魔不成活
显然，他对秦恒的期待比其他人更高。,星武纪元,第009章 不疯魔不成活
“是，一定不会让您失望的！”秦恒拍着胸脯说道。,星武纪元,第009章 不疯魔不成活
昨晚上一夜的修炼，让他的拳力增长了240公斤。,星武纪元,第009章 不疯魔不成活
今天再修炼一晚，不知道又能提升多少。,星武纪元,第009章 不疯魔不成活
“去吧。”,星武纪元,第009章 不疯魔不成活
杨怀安摆摆手，众人一起离开。,星武纪元,第009章 不疯魔不成活
这次7号贫民区报名的人一共有26个，其中一部分是复考，初考的只有9个。,星武纪元,第009章 不疯魔不成活
初考与复考虽然是同一个考场，但待遇是截然不同的。,星武纪元,第009章 不疯魔不成活
训练三年参加初考，训练四年参加初考，也有很大区别。,星武纪元,第009章 不疯魔不成活
训练时间越短、初考成绩越高，将来得到的待遇就会越好。,星武纪元,第009章 不疯魔不成活
而复考的人，哪怕一拳打出800公斤力量，待遇也较为普通。,星武纪元,第009章 不疯魔不成活
而复考的人，哪怕一拳打出800公斤力量，待遇也较为普通。,星武纪元,第010章 考核之日到来
晚上6点，秦恒再次来到天台，修炼《先天胎息功》。,星武纪元,第010章 考核之日到来
今天早上的拳力测试，让他看到了《先天胎息功》的可怕之处。,星武纪元,第010章 考核之日到来
所以这一次格外认真，充满了期待。,星武纪元,第010章 考核之日到来
天还没完全黑下来，他静坐修炼，调节好呼吸，使自己进入状态。,星武纪元,第010章 考核之日到来
很快，昨晚那种舒适、放松的感觉再次出现。,星武纪元,第010章 考核之日到来
滋滋~,星武纪元,第010章 考核之日到来
电流流转的感觉再次出现了。,星武纪元,第010章 考核之日到来
秦恒全神贯注，察觉到自己的身体，在极静之下，产生了一种有别于呼吸的运作模式，肌理皮肤每一个细胞都好像一座发电机，通过吸收着外界游离的自然能量，来发出“电能”，补充到身体各处。,星武纪元,第010章 考核之日到来
初升的月亮，游走的清风，无形的磁场，都是推动发电机运转的能量。,星武纪元,第010章 考核之日到来
而这些能量，最终都储存在他的肌肉骨骼当中，形成了力量。,星武纪元,第010章 考核之日到来
“好舒服的感觉，一点也不像陈元说的那样艰难煎熬。”秦恒暗道。,星武纪元,第010章 考核之日到来
白天和陈元交流修炼心得的时候，陈元说修炼的时候身体会微微疼痛，而且过程很难熬，顶多三个小时就受不了了。,星武纪元,第010章 考核之日到来
但对秦恒而言，这个过程反而是种享受，要不是肚子会饿、需要上厕所，他感觉自己一口气保持几个月修炼都没问题。,星武纪元,第010章 考核之日到来
天快亮的时候，秦恒结束了修炼。,星武纪元,第010章 考核之日到来
“啧啧，力量明显又增大了。”,星武纪元,第010章 考核之日到来
他捏了一下拳头，关节发出低沉的声响，五指的力道好像可以捏碎花岗岩。,星武纪元,第010章 考核之日到来
“我现在的拳力，肯定超过了800公斤！”,星武纪元,第010章 考核之日到来
这可不是个小数目。,星武纪元,第010章 考核之日到来
初考800公斤是可以上电视台的！,星武纪元,第010章 考核之日到来
今天他就要参加考核，说不定可以一鸣惊人，震惊整个基地市！,星武纪元,第010章 考核之日到来
“先回家吃饭。”,星武纪元,第010章 考核之日到来
秦恒下楼，返回住处。,星武纪元,第010章 考核之日到来
爸妈知道他今天要参加准武者考核，早早就起来给他做饭。,星武纪元,第010章 考核之日到来
一家三口坐在一起吃粥。,星武纪元,第010章 考核之日到来
“小恒，准考证记得一定要带，到了考场不要紧张，放轻松一些。”老爸拍着他的肩膀说道。,星武纪元,第010章 考核之日到来
秦恒自信的道：“爸妈放心，我一定通过考核！等我赚够了钱，咱们就搬去新城区的电梯房住，以后你们就可以天天下楼散心了！”,星武纪元,第010章 考核之日到来
老妈笑说道：“我们在这住习惯了倒是无所谓，你要是真的赚大钱了，第一件事必须是迎娶小雪，不能辜负了人家这些年的付出。”,星武纪元,第010章 考核之日到来
“那是肯定！”秦恒点头。,星武纪元,第010章 考核之日到来
他都想好了，自己成为武者需要的时间应该不长，等几个月后，方凌雪十八岁生日，就向她求婚。,星武纪元,第010章 考核之日到来
到时候他也差不多攒了一笔小钱了，婚礼可以办得隆重一点，把所有亲朋好友都请过来一起做见证！,星武纪元,第010章 考核之日到来
“来，把这俩鸡蛋吃了，争取考个100分！”,星武纪元,第010章 考核之日到来
盛玉涵将做好的早餐端了上来。,星武纪元,第010章 考核之日到来
贫民区的人吃不吃早餐，主要看今天有没有事情做。,星武纪元,第010章 考核之日到来
如果要务工，是体力活就吃，不是体力活就忍着中午再吃。,星武纪元,第010章 考核之日到来
秦恒爸妈身体不便无法务工，早上经常装睡不起来，熬到中午再吃饭。,星武纪元,第010章 考核之日到来
不过这两天比较特殊，秦恒考核在即，他们也都是很早起来，还专门煮了鸡蛋。,星武纪元,第010章 考核之日到来
“好香啊，今天什么菜？”秦恒嗅到一股特殊的香味。,星武纪元,第010章 考核之日到来
定睛一看，原来是昨天吃完的猪肘骨，洗干净和咸菜放一起炖了。,星武纪元,第010章 考核之日到来
“骨头炖咸菜，这可是我们小时候能吃到最好的美食了。”秦子明笑说道。,星武纪元,第010章 考核之日到来
“真香！”秦恒脸上在笑，心里却暗暗叹息。,星武纪元,第010章 考核之日到来
爸妈生在乱世，那时候可比现在艰苦多了，三天饿六顿是常态，吃不饱穿不暖，也没有接受教育的机会，能够活下来就已经是幸运者。,星武纪元,第010章 考核之日到来
现在时代好了，作为儿子，爸妈在他身上倾注了所有的心血与希望。,星武纪元,第010章 考核之日到来
所以今天的考核，必须拿出最好的状态去应对！,星武纪元,第010章 考核之日到来
“开饭！”,星武纪元,第010章 考核之日到来
秦恒大口吃着，把肚子填饱。,星武纪元,第010章 考核之日到来
吃完饭，他便带上准考证，在爸妈满眼期盼的目光注视下，走出了家门。,星武纪元,第010章 考核之日到来
不一会儿，秦恒来到武馆。,星武纪元,第010章 考核之日到来
时间还挺早，7点20分，距离杨教练所说的集合时间，还有40分钟。,星武纪元,第010章 考核之日到来
不过准备参加考核的人，已经陆陆续续都到齐了。连带着他们的家人、朋友，也有不少过来相送的。,星武纪元,第010章 考核之日到来
“嘿，秦恒。”,星武纪元,第010章 考核之日到来
一个古铜色皮肤的少年走了过来。,星武纪元,第010章 考核之日到来
“周岩师兄，好久没见到你了，最近都在苦练吗？”秦恒笑着回应。,星武纪元,第010章 考核之日到来
周岩和他关系不错，此人去年考核没过，今年上半年还经常在武馆看到，下半年就不知所踪了。,星武纪元,第010章 考核之日到来
周岩语气无奈的道：“苦练个锤子哦，穷得揭不开锅，都交不起武馆的会员费了。这半年我一直在打工，要不然你今天都看不到我，只能看到一个饿死鬼。”,星武纪元,第010章 考核之日到来
“哈哈哈，周师兄太幽默了，我看你胖了一圈，哪里像是吃不起饭的样子？”,星武纪元,第010章 考核之日到来
秦恒和其他人都笑了。,星武纪元,第010章 考核之日到来
周岩嘿嘿一笑，拍了拍自己略微凸出的肚子，回道：“还行还行，主要是找的工作比较好，伙食油水多，这才吃出了福相。”,星武纪元,第010章 考核之日到来
“哦？什么工作？居然还包伙食？”众人都对此很感兴趣。,星武纪元,第010章 考核之日到来
周岩压低嗓音，神秘兮兮的道：“就是去新城区的紫光会所伺候富婆，拳力过500公斤的准武者一次能给30元，要是把客人伺候高兴了，还能拿小费！”,星武纪元,第010章 考核之日到来
“呃……”,星武纪元,第010章 考核之日到来
秦恒表情一僵。,星武纪元,第010章 考核之日到来
苏狂大笑：“你还别说，这个很适合秦恒啊，他就擅长这个！”,星武纪元,第010章 考核之日到来
周岩面露诧异之色：“真的假的？秦恒你还有这技术？那我改天跟我老板介绍介绍……”,星武纪元,第010章 考核之日到来
秦恒：……,星武纪元,第010章 考核之日到来
他连忙解释：“别听苏狂瞎说，他就是嫉妒我有女朋友。”,星武纪元,第010章 考核之日到来
周岩恍然：“原来是这样，我还以为你活很好呢。”,星武纪元,第010章 考核之日到来
众人一阵哄堂大笑。,星武纪元,第010章 考核之日到来
“人都齐了吗？”,星武纪元,第010章 考核之日到来
这时候，杨教练来了。,星武纪元,第010章 考核之日到来
陈元点了一下人数，说道：“除了汪鹏都在这里。”,星武纪元,第010章 考核之日到来
“准考证呢？”杨教练又问，生怕众人遗漏了必需品。,星武纪元,第010章 考核之日到来
秦恒等人纷纷拿出自己的准考证。,星武纪元,第010章 考核之日到来
