参数1_文本,书名,章节名称
沈灵儿开心地笑起来，眼睛都眯成了月牙儿。,大雪满龙刀,0017、刀不留人
这几日吃饱喝好，小丫头脸上有了血色，看起来健康了许多。,大雪满龙刀,0017、刀不留人
李七玄也觉得沈灵儿的手艺实在了得，不由好奇问了一句。,大雪满龙刀,0017、刀不留人
沈灵儿道：“家里以前是开饭馆的，爹娘都做得一手好菜，前几年生意很不错，我也跟着学了点手艺，后来娘被一个吃饭不付钱的武林高手打成重伤，花了很多钱都治不好，爹把宅子和饭馆都买了，凑钱给娘治伤，结果钱花完了，娘死了……”,大雪满龙刀,0017、刀不留人
说着，她眼眶又红了。,大雪满龙刀,0017、刀不留人
李七玄不由心疼这个懂事的小丫头。,大雪满龙刀,0017、刀不留人
他话题一转，问道：“六月姐喜欢吃你做的饭，不如这样，以后家里的饭就承包给你，我给你付工钱，怎么样？”,大雪满龙刀,0017、刀不留人
“灵儿当然愿意给六月姐和小七哥你们做饭。”,大雪满龙刀,0017、刀不留人
沈灵儿连忙道：“但是灵儿不能收工钱，因为我们是朋友。”,大雪满龙刀,0017、刀不留人
李六月大手一挥，道：“不收钱，那就每天都和我们一起吃，你看你瘦的，吃饱了才能长力气。”,大雪满龙刀,0017、刀不留人
沈灵儿还想要说什么，李七玄故意道：“咱们是好朋友哎，灵儿你也不想自己的好朋友每天都没有一口热饭吃吧？”,大雪满龙刀,0017、刀不留人
“这……好吧，谢谢六月姐，小七哥。”,大雪满龙刀,0017、刀不留人
沈灵儿知道他们这是在变相地帮助自己。,大雪满龙刀,0017、刀不留人
其他的不说，在这贫民区里，除了这个小院，还有谁家每天的饭菜里能有菜有肉。,大雪满龙刀,0017、刀不留人
这里的一顿饭，抵得上贫民区很多活计一个月的工钱了。,大雪满龙刀,0017、刀不留人
吃完饭，李七玄照例单独出门。,大雪满龙刀,0017、刀不留人
他准备前往雪狮镖局，登门拜师。,大雪满龙刀,0017、刀不留人
距离那位女武官所说的三日时间越来越近，他必须尽快找到靠山。,大雪满龙刀,0017、刀不留人
到了主街，路过一处茶馆，就茶客们正在议论昨日林震北和独孤一刀两大‘听雪榜’强者的榜首之战。,大雪满龙刀,0017、刀不留人
“真没想到啊，这一战竟然是林老镖头赢了。”,大雪满龙刀,0017、刀不留人
“真没想到啊，这一战竟然是林老镖头赢了。”,大雪满龙刀,0018、入门考核
“不是说林老镖头年长力衰，实力下降的厉害吗？”,大雪满龙刀,0018、入门考核
“是啊，真让人意外。”,大雪满龙刀,0018、入门考核
“据说门主独孤一刀已经是七次洗髓了，镇宗刀法【神刀斩】也修炼到了前无古人的境界，坊间早有传闻他才是名副其实的听雪城第一强者，没想到居然输了。”,大雪满龙刀,0018、入门考核
“姜还是老的辣。”,大雪满龙刀,0018、入门考核
“你们听说了没，昨日一战后，雪狮镖局突然对外宣布收学徒……”,大雪满龙刀,0018、入门考核
“真的假的？”,大雪满龙刀,0018、入门考核
“谁知道呢，估计是镖局想要扩张吧。”,大雪满龙刀,0018、入门考核
李七玄听到这里，不由得心中一动。,大雪满龙刀,0018、入门考核
这可真的是个好消息。,大雪满龙刀,0018、入门考核
他原本还想要如何展现‘天赋’，才能加入雪狮镖局。,大雪满龙刀,0018、入门考核
没想到机会这就来了。,大雪满龙刀,0018、入门考核
半个时辰后。,大雪满龙刀,0018、入门考核
李七玄来到了位于南城区的晴天大街。,大雪满龙刀,0018、入门考核
雪狮镖局就位于大街正中。,大雪满龙刀,0018、入门考核
和昨天来时大门紧闭不一样，今日的雪狮镖局，大门敞开，外面已是排起了百米长队。,大雪满龙刀,0018、入门考核
都是来接受测试，想要成为学徒的年轻人。,大雪满龙刀,0018、入门考核
【听雪第一刀】名震八方。,大雪满龙刀,0018、入门考核
镖局的吸引力还是很大的。,大雪满龙刀,0018、入门考核
李七玄不动声色地排到了队伍末尾。,大雪满龙刀,0018、入门考核
伟大的医学家周树人曾经曰过，排队最大的乐趣，不是你前面的人越来越少，而是你后面的人越来越多。,大雪满龙刀,0018、入门考核
李七玄深有此感。,大雪满龙刀,0018、入门考核
小半个时辰过去。,大雪满龙刀,0018、入门考核
不断有年轻人失魂落魄地从镖局大门中走出来，一脸失望。,大雪满龙刀,0018、入门考核
显然是未通过考核被淘汰了。,大雪满龙刀,0018、入门考核
李七玄随着队伍进入大门。,大雪满龙刀,0018、入门考核
门后是外院，有一个占地超过一亩的练武场。,大雪满龙刀,0018、入门考核
雪狮镖局的入门测试，正在练武场上如火如荼地进行中。,大雪满龙刀,0018、入门考核
李七玄观察一阵，大致就明白了测试内容。,大雪满龙刀,0018、入门考核
这个院子里进行的是基础的力量、耐力测试。,大雪满龙刀,0018、入门考核
内容很简单。,大雪满龙刀,0018、入门考核
就是举石锁。,大雪满龙刀,0018、入门考核
共有五十斤，一百斤，一百五十斤，两百斤，三百斤和五百斤六个级别的石锁。,大雪满龙刀,0018、入门考核
但凡有人能够将五百斤石锁提起离地三尺一次，或者一次性将三百斤石锁举过头顶，或者是举起五十斤石锁三十次，举起一百斤石锁十五次，举起一百五十斤石锁十次，举起两百斤石锁五次，就算是通过考验。,大雪满龙刀,0018、入门考核
这个考核标准，不可谓不高。,大雪满龙刀,0018、入门考核
排队测试的人，十个里面有八个被淘汰。,大雪满龙刀,0018、入门考核
“程诸，举三百斤石锁失败……淘汰。”,大雪满龙刀,0018、入门考核
“薛宇，举一百斤石锁六次……淘汰。”,大雪满龙刀,0018、入门考核
“林爽，举五十斤石锁二十五次……淘汰。”,大雪满龙刀,0018、入门考核
“陆秋白，举两百斤石锁五次……合格。”,大雪满龙刀,0018、入门考核
人群中爆发出一片惊呼。,大雪满龙刀,0018、入门考核
终于有人成功跨过了力量测试。,大雪满龙刀,0018、入门考核
叫做陆秋白的是一个身穿白袍，女身男相的少女。,大雪满龙刀,0018、入门考核
柔和的金色阳光下，陆秋白长身而立。,大雪满龙刀,0018、入门考核
她身段高挑，剑眉杏眸，看起来只有十五六岁，明明是一个女孩子，却有着许多男孩子都无法企及的英武之气，称得上一句英姿勃发人如冠玉。,大雪满龙刀,0018、入门考核
少女通过测试一脸傲娇，在一位镖师的引领下，进入了内院，接受下一项测试。,大雪满龙刀,0018、入门考核
过了片刻，就轮到了李七玄。,大雪满龙刀,0018、入门考核
一位三十岁左右的白净帅气镖师是主考官，笑着问道：“小兄弟，你选哪个石锁？”,大雪满龙刀,0018、入门考核
李七玄几乎没有任何犹豫，就来到了五百斤石锁面前。,大雪满龙刀,0018、入门考核
“我选它。”,大雪满龙刀,0018、入门考核
李七玄道。,大雪满龙刀,0018、入门考核
“哦？”,大雪满龙刀,0018、入门考核
白净帅气镖师主考官神色惊讶。,大雪满龙刀,0018、入门考核
他好心地提醒道：“到目前为止，接受考核的一百四十五人中，只有一人勉强将五百斤石锁提离地面一尺，小兄弟，机会只有一次，切莫大意，要是失败了，可不会有第二次选择其它重量石锁的机会。”,大雪满龙刀,0018、入门考核
其他一些等待接受测试的年轻人，也都将目光聚焦在了李七玄身上。,大雪满龙刀,0018、入门考核
“这小子瘦胳膊瘦腿，居然挑战五百斤？”,大雪满龙刀,0018、入门考核
“不知所谓。”,大雪满龙刀,0018、入门考核
“等着看笑话吧。”,大雪满龙刀,0018、入门考核
有人故意大声地议论。,大雪满龙刀,0018、入门考核
李七玄弯腰，双手握住石锁，将其提离地面。,大雪满龙刀,0018、入门考核
在一片惊呼声中，李七玄轻松就将这五百斤石锁提到离地一尺。,大雪满龙刀,0018、入门考核
但他的表演，还未结束。,大雪满龙刀,0018、入门考核
石锁被他一点一点继续向上举，最终彻底举过头顶。,大雪满龙刀,0018、入门考核
所有的惊呼声戛然而止。,大雪满龙刀,0018、入门考核
无数道目光震惊地看着李七玄。,大雪满龙刀,0018、入门考核
方才那几个故意大声嘲讽的年轻人，更是恨不得找个地缝钻进去。,大雪满龙刀,0018、入门考核
白净镖师也是张大了嘴巴，一时之间为之失语。,大雪满龙刀,0018、入门考核
“这样可以了吗？”,大雪满龙刀,0018、入门考核
李七玄面不红气不喘，轻松地问道。,大雪满龙刀,0018、入门考核
“啊……可以了，可以了。”,大雪满龙刀,0018、入门考核
白净镖师主考官这才回过神来，看了一眼手中的登记资料，大声地道：“李七玄举起百五斤石锁过顶，成绩合格。”,大雪满龙刀,0018、入门考核
李七玄缓缓地将石锁放在地上，不溅尘埃。,大雪满龙刀,0018、入门考核
这个动作，更说明他犹有余力。,大雪满龙刀,0018、入门考核
白净镖师主考官像是看怪物一样看着李七玄，忍不住又看了一眼手中的登记资料。,大雪满龙刀,0018、入门考核
十五岁，未习武。,大雪满龙刀,0018、入门考核
这是一个天生神力的怪胎啊。,大雪满龙刀,0018、入门考核
这样的人，一旦‘换力’完毕，就算是境界不高，实战能力也会非常恐怖。,大雪满龙刀,0018、入门考核
“小兄弟，在下白望龙，是雪狮镖局的镖头之一。。”,大雪满龙刀,0018、入门考核
白净镖师主考官自报姓名，脸上露出和善笑意，道：“你跟我来吧。”,大雪满龙刀,0018、入门考核
李七玄跟随在白望龙身后，进入第二道门，穿过其后的风雨连廊，来到了内院。,大雪满龙刀,0018、入门考核
这时，消息已经传到内院，很多人都已经听说，前院出现了一个将五百斤石锁举过顶天才。,大雪满龙刀,0018、入门考核
李七玄一进门，顿时无数道目光，都聚焦在他的身上。,大雪满龙刀,0018、入门考核
那个叫做陆秋白的‘英武少女’，也用审视的目光，不断地打量着李七玄。,大雪满龙刀,0018、入门考核
“总镖头。”,大雪满龙刀,0018、入门考核
白望龙来到一位青色长袍的儒雅中年人面前拱手行礼，然后凑过去，在耳边低声说了几句什么。,大雪满龙刀,0018、入门考核
青色长袍儒雅中年人‘哦’了一声，面露惊讶，朝着李七玄看来。,大雪满龙刀,0018、入门考核
白望龙介绍道：“小兄弟，这位是我们雪狮镖局的林总镖头。”,大雪满龙刀,0018、入门考核
李七玄立刻无比惊喜的模样，道：“您就是听雪榜第一的林震北总镖头？真年轻呀，我是……您是我偶像！”,大雪满龙刀,0018、入门考核
不论如何，态度得表现出来。,大雪满龙刀,0018、入门考核
青色长袍儒雅中年人微微一笑，随和地道：“在下林逸风，是老爷子的嫡孙，如今掌管镖局。”,大雪满龙刀,0018、入门考核
“啊这……”,大雪满龙刀,0018、入门考核
李七玄有点尴尬。,大雪满龙刀,0018、入门考核
认错人了。,大雪满龙刀,0018、入门考核
经过白望龙在一边介绍，李七玄才知道大致情况。,大雪满龙刀,0018、入门考核
雪狮镖局的老总镖头林震北常年闭关，很少参与镖局的管理经营，大小事务一般都是由唯一的孙子林逸风处理。,大雪满龙刀,0018、入门考核
林逸风看着只有四十岁左右，实则已经年过五十。,大雪满龙刀,0018、入门考核
因为他武道修为高深，气血旺盛，锁住了体内精气不外泄，所以看起来比实际年龄年轻很多。,大雪满龙刀,0018、入门考核
李七玄拱手：“见过林总镖头。”,大雪满龙刀,0018、入门考核
林逸风面容儒雅，不似是武林中人，反而像是一位饱读之士。,大雪满龙刀,0018、入门考核
他面露微笑道：“小兄弟力量天赋惊人，想必去任何帮派都会被重点培养，不知道为何来参加我雪狮镖局的镖师选拔？”,大雪满龙刀,0018、入门考核
李七玄正色道：“在下不想成为助纣为虐的帮派爪牙，所以来镖局学艺。”,大雪满龙刀,0018、入门考核
林逸风颇为意外。,大雪满龙刀,0018、入门考核
这个问题，今日他问过其他一些符合选拔条件的少年。,大雪满龙刀,0018、入门考核
答案大同小异。,大雪满龙刀,0018、入门考核
基本上都是奔着他爷爷林震北这位‘听雪榜’排名第一的金字招牌来的。,大雪满龙刀,0018、入门考核
而眼前少年的回答，林逸风却还是第一次听到。,大雪满龙刀,0018、入门考核
而眼前少年的回答，林逸风却还是第一次听到。,大雪满龙刀,0019、斩鬼九刀
林逸风不由又认真打量眼前少年。,大雪满龙刀,0019、斩鬼九刀
破旧的短褂和长裤虽然布满补丁，但却浆洗的干干净净，舒适合身。,大雪满龙刀,0019、斩鬼九刀
身形清瘦挺拔，脊梁笔直。,大雪满龙刀,0019、斩鬼九刀
双眸明亮又清澈。,大雪满龙刀,0019、斩鬼九刀
浓密的眉毛仿佛是用刻刀画出的利落线条，刚硬笔直。,大雪满龙刀,0019、斩鬼九刀
双眉犹如两把锋利的长刀。,大雪满龙刀,0019、斩鬼九刀
眉尾斜飞入鬓。,大雪满龙刀,0019、斩鬼九刀
这少年站在林逸风的面前，气质阳刚，英武挺拔。,大雪满龙刀,0019、斩鬼九刀
就如一把材质绝佳的上等刀胚。,大雪满龙刀,0019、斩鬼九刀
虽未开刃，却有一股锋锐之气自然而然地散发出来，令人无法忽视。,大雪满龙刀,0019、斩鬼九刀
“你在第一关的力量考核中鹤立鸡群，但还需再过刀法悟性考核，才能加入雪狮镖局。”,大雪满龙刀,0019、斩鬼九刀
林逸风面露微笑，道：“希望你能顺利过关。”,大雪满龙刀,0019、斩鬼九刀
“多谢林镖头。”,大雪满龙刀,0019、斩鬼九刀
李七玄不卑不亢地道。,大雪满龙刀,0019、斩鬼九刀
所谓的刀法悟性考试，也很简单。,大雪满龙刀,0019、斩鬼九刀
雪狮镖局会给每位少年一本刀谱，限时一炷香之内领悟参详。,大雪满龙刀,0019、斩鬼九刀
然后再当众演示出来。,大雪满龙刀,0019、斩鬼九刀
领悟越多，成绩越高。,大雪满龙刀,0019、斩鬼九刀
这一关的考核，是按顺序分批进行的。,大雪满龙刀,0019、斩鬼九刀
在白望龙的带领之下，李七玄来到练武场左侧的棚子下，静坐喝茶，耐心等待。,大雪满龙刀,0019、斩鬼九刀
‘英武少女’陆秋白和其他九位通过第一关考核的少年，分别被引入了内院十间练刀房，开始计时参悟刀谱。,大雪满龙刀,0019、斩鬼九刀
一炷香过去。,大雪满龙刀,0019、斩鬼九刀
不断有成绩公布出来。,大雪满龙刀,0019、斩鬼九刀
“辛子啸，计时内领悟三招刀法，通过。”,大雪满龙刀,0019、斩鬼九刀
“李建明，计时内领悟半招刀法，淘汰。”,大雪满龙刀,0019、斩鬼九刀
“朱武胜，计时内领悟一招刀法，淘汰。”,大雪满龙刀,0019、斩鬼九刀
“赵元龙……”,大雪满龙刀,0019、斩鬼九刀
“钱万叁……”,大雪满龙刀,0019、斩鬼九刀
“陆秋白，计时内领悟七招刀法，通过。”,大雪满龙刀,0019、斩鬼九刀
这一批的考核成绩，最终全部唱喏公布出来。,大雪满龙刀,0019、斩鬼九刀
接受考核的十名少年中，有七人被淘汰，只留下了辛子啸，陆秋白和谢客四人。,大雪满龙刀,0019、斩鬼九刀
这四人中，陆秋白成绩最好，一炷香之内领悟了七招刀法，谢客的六招居于次席。,大雪满龙刀,0019、斩鬼九刀
主持考核的林逸风脸上的笑就没有停过。,大雪满龙刀,0019、斩鬼九刀
这次开门收徒，本是迫于压力的无奈之举。,大雪满龙刀,0019、斩鬼九刀
没想到还真的发现了几个天赋绝佳的好苗子。,大雪满龙刀,0019、斩鬼九刀
比如刚才通过考核的陆秋白和谢客两人，都是十四岁的年龄，力量和悟性堪称上等。,大雪满龙刀,0019、斩鬼九刀
现在只需要调查一下这两个人的跟脚，只要不是五大门派插进来的奸细，那就可以重点培养了。,大雪满龙刀,0019、斩鬼九刀
“也不知道，那个天生神力的李七玄悟性如何？”,大雪满龙刀,0019、斩鬼九刀
林逸风心中产生了期待。,大雪满龙刀,0019、斩鬼九刀
不知道为何，他总觉得，那少年的身上，有一股气势，和年轻时代的爷爷林震北颇为相似。,大雪满龙刀,0019、斩鬼九刀
“这个李七玄，不求他悟性如陆秋白一般变态，只要有陆秋白的一半，也可以重点培养。”,大雪满龙刀,0019、斩鬼九刀
林逸风期待着。,大雪满龙刀,0019、斩鬼九刀
与此同时。,大雪满龙刀,0019、斩鬼九刀
在一等镖师白望龙的引领之下，李七玄和九名通过第一关考核的少年，走向室内练武场。,大雪满龙刀,0019、斩鬼九刀
“希望你不是一个只有蛮力的傻大个，不然，我会赢得很无趣。”,大雪满龙刀,0019、斩鬼九刀
门口，英武飒爽的美少女陆秋白抱臂而立，目光灼灼，盯着李七玄。,大雪满龙刀,0019、斩鬼九刀
她已经将李七玄当成了竞争对手。,大雪满龙刀,0019、斩鬼九刀
然而李七玄的脚步却没有停顿。,大雪满龙刀,0019、斩鬼九刀
甚至连目光都没有在陆秋白的身上有丝毫停留。,大雪满龙刀,0019、斩鬼九刀
别人是来学艺的。,大雪满龙刀,0019、斩鬼九刀
他是来求生，是来活命的。,大雪满龙刀,0019、斩鬼九刀
李七玄目不斜视地走进了六号练刀房。,大雪满龙刀,0019、斩鬼九刀
室内约有十平米空间，通风设计不错，光线明亮，暗红色的木地板考究细腻。,大雪满龙刀,0019、斩鬼九刀
四面墙壁上挂着修多刀。,大雪满龙刀,0019、斩鬼九刀
有长刀，双短刀，直刀，弯刀，长柄砍刀，苗刀，大环刀，鬼头刀。,大雪满龙刀,0019、斩鬼九刀
雪狮镖局林家以刀法闻名，传承的武功自然是以刀法为主。,大雪满龙刀,0019、斩鬼九刀
练刀房靠墙的石桌上，摆着一本蓝色封装的刀谱。,大雪满龙刀,0019、斩鬼九刀
“计时开始。”,大雪满龙刀,0019、斩鬼九刀
“一炷香之内，练会刀谱中的三招刀法，即可通过本关测试。”,大雪满龙刀,0019、斩鬼九刀
主考官白望龙的声音，从外面清晰地传进来。,大雪满龙刀,0019、斩鬼九刀
李七玄拿起刀谱一看。,大雪满龙刀,0019、斩鬼九刀
首页有【斩鬼九式】四个大字。,大雪满龙刀,0019、斩鬼九刀
翻开来看。,大雪满龙刀,0019、斩鬼九刀
发现这是一门换力境刀法。,大雪满龙刀,0019、斩鬼九刀
品秩与【追风七刀】相当。,大雪满龙刀,0019、斩鬼九刀
按照刀法简介来看，这是一门特别针对妖鬼的刀法。,大雪满龙刀,0019、斩鬼九刀
李七玄翻看了一遍，发现自己并未能领悟太多。,大雪满龙刀,0019、斩鬼九刀
按照这样的效率，一炷香时间之内，能够学会一招半式就不错了。,大雪满龙刀,0019、斩鬼九刀
主要是吃亏在他穿越者的思维习惯，以及武学基础理论知识匮乏，还有练武经验不足。,大雪满龙刀,0019、斩鬼九刀
和那些有一定武道底子的少年无法相提并论。,大雪满龙刀,0019、斩鬼九刀
他暗自庆幸，幸亏昨晚没有用第三枚龙鳞来修炼【狂雪八斩法】。,大雪满龙刀,0019、斩鬼九刀
否则，今天这一关别说是通过，只怕是要拉一坨大的。,大雪满龙刀,0019、斩鬼九刀
“学习【斩鬼九式】。”,大雪满龙刀,0019、斩鬼九刀
李七玄意念发动。,大雪满龙刀,0019、斩鬼九刀
胸前神龙刺青上那第三枚龙鳞，发射出一道无人可见的青光，照射在刀谱上。,大雪满龙刀,0019、斩鬼九刀
下一瞬间，仿佛是有无尽混沌衍化，脑海中修炼【斩鬼九式】的无数画面走马灯般闪过。,大雪满龙刀,0019、斩鬼九刀
几个呼吸之间，李七玄就彻底学会了【斩鬼九式】。,大雪满龙刀,0019、斩鬼九刀
而且臻致刀法大圆满。,大雪满龙刀,0019、斩鬼九刀
他查看自己的前胸。,大雪满龙刀,0019、斩鬼九刀
三枚龙鳞各自闪烁微光。,大雪满龙刀,0019、斩鬼九刀
其上便有‘追风七刀’、‘飞霜雪影步’和‘斩鬼九式’的细微字迹。,大雪满龙刀,0019、斩鬼九刀
“神龙刺青吸收妖鬼邪能和生命能量，可以强化肉身，具现龙鳞。”,大雪满龙刀,0019、斩鬼九刀
“而龙鳞又可以瞬间学会武功……”,大雪满龙刀,0019、斩鬼九刀
“只要充分发挥神龙刺青的能力，我可以快速变强。”,大雪满龙刀,0019、斩鬼九刀
李七玄整理思绪，踌躇满志。,大雪满龙刀,0019、斩鬼九刀
转眼之间。,大雪满龙刀,0019、斩鬼九刀
一炷香时间过去。,大雪满龙刀,0019、斩鬼九刀
十名镖师走进不同的练刀房，开始考核。,大雪满龙刀,0019、斩鬼九刀
少年们各自开始演示所领悟的刀法。,大雪满龙刀,0019、斩鬼九刀
之前的镖头白望龙走进六号练刀房，站李七玄的面前，笑着道：“不用紧张，记住多少，就施展多少。”,大雪满龙刀,0019、斩鬼九刀
李七玄取下墙上一把横刀，握在手中，微微闭眼，猛然睁眼，刀招施展出来。,大雪满龙刀,0019、斩鬼九刀
第一招‘闪芒斩’。,大雪满龙刀,0019、斩鬼九刀
第二招‘裂空斩’。,大雪满龙刀,0019、斩鬼九刀
第三招‘鬼芒斩’,大雪满龙刀,0019、斩鬼九刀
第四招……,大雪满龙刀,0019、斩鬼九刀
第五招……,大雪满龙刀,0019、斩鬼九刀
一直到第九招‘千芒斩’。,大雪满龙刀,0019、斩鬼九刀
李七玄连绵不绝地施展出来，招式转换之间，虽然有小小卡顿，但完成度却毫无问题。,大雪满龙刀,0019、斩鬼九刀
九招结束。,大雪满龙刀,0019、斩鬼九刀
李七玄收刀而立。,大雪满龙刀,0019、斩鬼九刀
为了不显得过于变态引起怀疑，他只是显露了‘入门级’的刀法水准。,大雪满龙刀,0019、斩鬼九刀
并未暴露已经臻至【斩鬼九式】刀法大圆满的事实。,大雪满龙刀,0019、斩鬼九刀
即便如此，站在他面前的评为白望龙，已经彻底呆滞。,大雪满龙刀,0019、斩鬼九刀
他揉了揉眼睛，下意识地想要让李七玄再演示一遍。,大雪满龙刀,0019、斩鬼九刀
因为有点儿不敢相信自己看到的。,大雪满龙刀,0019、斩鬼九刀
这一套【斩鬼九式】是听雪城第一强者的林震北老爷子，专门为此次招收学徒所打造的刀法，从未在外界流传过。,大雪满龙刀,0019、斩鬼九刀
所以不可能有人提前练习掌握。,大雪满龙刀,0019、斩鬼九刀
也就是说，眼前少年在短短一炷香的时间里，就将这一门换力境刀法领悟熟练了。,大雪满龙刀,0019、斩鬼九刀
这时何等变态的天赋！,大雪满龙刀,0019、斩鬼九刀
“穆林，计时内领悟两招刀法，淘汰。”,大雪满龙刀,0019、斩鬼九刀
“李森，计时内领悟一招半刀法，淘汰。”,大雪满龙刀,0019、斩鬼九刀
“罗振业，计时内领悟四招刀法，合格。”,大雪满龙刀,0019、斩鬼九刀
“周轩……”,大雪满龙刀,0019、斩鬼九刀
“聂涛……”,大雪满龙刀,0019、斩鬼九刀
“曲玉宁……”,大雪满龙刀,0019、斩鬼九刀
一间间练刀房内，镖师们的声音不断传出。,大雪满龙刀,0019、斩鬼九刀
到了最后，也就只有李七玄的成绩还未报告。,大雪满龙刀,0019、斩鬼九刀
一时间，无数目光都看向六号练刀房。,大雪满龙刀,0019、斩鬼九刀
一时间，无数目光都看向六号练刀房。,大雪满龙刀,0020、光明磊落李七玄
“李七玄，计时内领悟全部刀法，且达到熟练程度，合格。”,大雪满龙刀,0020、光明磊落李七玄
终于，白望龙的声音洪亮回荡在内院之中。,大雪满龙刀,0020、光明磊落李七玄
原本嘈杂的内院瞬间变得鸦雀无声。,大雪满龙刀,0020、光明磊落李七玄
包括天才少女陆秋白在内，所有已经通过考核的少年们，个个脸上都写满了难以置信的表情。,大雪满龙刀,0020、光明磊落李七玄
